<!-- create an xml file containing records of employee having elements of simple and complex types. Write a schema to validate the xml file. Write a xslt to display the records in a table format. -->

<?xml version="1.0" encoding="UTF-8"?>
<employees xmlns:xsi="http://www.w3.org/2001/XMLSchema-instance" xsi:noNamespaceSchemaLocation="simple_ComplexTypes.xsd">
    <employee>
        <id>1</id>
        <name>
            <first>John</first>
            <last>Doe</last>
        </name>
        <position>Software Engineer</position>
        <department>Engineering</department>
        <salary>75000</salary>
    </employee>
    
    <employee>
        <id>2</id>
        <name>
            <first>Jane</first>
            <last>Smith</last>
        </name>
        <position>Marketing Specialist</position>
        <department>Marketing</department>
        <salary>60000</salary>
    </employee>

    <!-- Add more employee records as needed -->
</employees>